Cantidad_victimas,Fecha,Hora,Tipo_de_calle,Calle,Cruce,Dirección_normalizada,Comuna,Longitud,Latitud,Victima,Acusado
1,2016-01-01,04:00:00,AVENIDA,PIEDRA BUENA AV.,SI,"PIEDRA BUENA AV. y FERNANDEZ DE LA CRUZ, F., GRAL. AV.",8,-58.47533969,-34.68757022,MOTO,AUTO
1,2016-01-02,01:00:00,GRAL PAZ,"PAZ, GRAL. AV.",SI,"PAZ, GRAL. AV. y DE LOS CORRALES AV.",9,-58.50877521,-34.66977709,AUTO,PASAJEROS
1,2016-01-03,07:00:00,AVENIDA,ENTRE RIOS AV.,NO,ENTRE RIOS AV. 2034,1,-58.39040293,-34.63189362,MOTO,AUTO
1,2016-01-10,00:00:00,AVENIDA,LARRAZABAL AV.,SI,"LARRAZABAL AV. y VILLEGAS, CONRADO, GRAL.",8,-58.46503904,-34.68092974,MOTO,SD
1,2016-01-21,05:00:00,AVENIDA,SAN JUAN AV.,SI,"SAN JUAN AV. y SAENZ PEÃ‘A, LUIS, PRES.",1,-58.38718297,-34.6224663,MOTO,PASAJEROS
1,2016-01-24,18:00:00,AVENIDA,27 DE FEBRERO AV.,SI,27 DE FEBRERO AV. y ESCALADA AV.,8,-58.44451316,-34.68475866,MOTO,OBJETO FIJO
1,2016-01-24,19:00:00,CALLE,NOGOYA,SI,"NOGOYA y GONZALEZ, JOAQUIN V.",11,-58.50095869,-34.6082544,MOTO,AUTO
1,2016-01-29,15:00:00,GRAL PAZ,"PAZ, GRAL. AV.",SI,"PAZ, GRAL. AV. y DE LOS CORRALES AV.",9,-58.50877521,-34.66977709,MOTO,AUTO
1,2016-02-08,01:00:00,AVENIDA,BELGRANO AV.,SI,"BELGRANO AV. e IRIGOYEN, BERNARDO DE",1,-58.38048577,-34.61303893,MOTO,CARGAS
1,2016-02-10,11:00:00,AVENIDA,ENTRE RIOS AV.,NO,ENTRE RIOS AV. 1366,1,-58.39114932,-34.62477387,PEATON,AUTO
1,2016-02-14,05:00:00,AVENIDA,"SCALABRINI ORTIZ, RAUL AV.",SI,"SCALABRINI ORTIZ, RAUL AV. y VERA",15,-58.4376002,-34.59912758,PEATON,AUTO
1,2016-02-14,22:00:00,AVENIDA,REGIMIENTO DE PATRICIOS AV.,SI,"REGIMIENTO DE PATRICIOS AV. y QUINQUELA MARTIN, BENITO",4,-58.36882665,-34.64291993,MOTO,AUTO
1,2016-02-15,16:00:00,AVENIDA,"ACOSTA, MARIANO",SI,"ACOSTA, MARIANO y JANER, ANA MARIA",8,-58.44989671,-34.65970435,PEATON,MOTO
1,2016-02-17,09:00:00,CALLE,"DE LA TORRE, LISANDRO",SI,"DE LA TORRE, LISANDRO y GARCIA GRANDE DE ZEQUEIRA, SEVERO",9,-58.50990884,-34.65468721,PEATON,PASAJEROS
1,2016-02-17,16:00:00,CALLE,SUIPACHA,NO,SUIPACHA 156,1,-58.37952223,-34.60653282,PEATON,AUTO
1,2016-02-17,23:00:00,AVENIDA,DIRECTORIO AV.,SI,DIRECTORIO AV. y CURAPALIGUE,7,-58.45157703,-34.63063795,AUTO,AUTO
1,2016-02-21,06:00:00,AVENIDA,9 DE JULIO AV.,SI,"9 DE JULIO AV. y ALSINA, ADOLFO",1,-58.38144696,-34.61079875,MOTO,AUTO
1,2016-02-28,04:00:00,GRAL PAZ,"PAZ, GRAL. AV.",SI,"PAZ, GRAL. AV. y 27 DE FEBRERO AV.",8,-58.46244952,-34.70524971,AUTO,AUTO
1,2016-02-28,07:00:00,CALLE,HOLMBERG,SI,HOLMBERG y VEDIA,12,-58.49216191,-34.54738649,AUTO,OBJETO FIJO
1,2016-02-28,09:00:00,AVENIDA,CURAPALIGUE AV.,SI,"CURAPALIGUE AV. y DIAZ, AVELINO",7,-58.44497874,-34.63852623,AUTO,AUTO
1,2016-03-02,10:00:00,AVENIDA,VIAMONTE,SI,VIAMONTE y 9 DE JULIO AV.,1,-58.38199706,-34.60028648,PEATON,CARGAS
1,2016-03-04,17:00:00,AVENIDA,CABILDO AV.,SI,CABILDO AV. y DEHEZA,12,-58.47378664,-34.54153077,PEATON,PASAJEROS
1,2016-03-08,12:00:00,GRAL PAZ,"PAZ, GRAL. AV.",SI,"PAZ, GRAL. AV. y ROCA, CNEL. AV.",8,-58.47064556,-34.69843756,MOTO,PASAJEROS
1,2016-03-12,12:00:00,AVENIDA,"ALCORTA, AMANCIO AV.",SI,"ALCORTA, AMANCIO AV. y BONAVENA, OSCAR NATALIO",4,-58.40623949,-34.65076549,PEATON,PASAJEROS
1,2016-03-13,06:00:00,AVENIDA,CORRIENTES AV.,SI,CORRIENTES AV. y CALLAO AV.,3,-58.39228965,-34.60443527,MOTO,PASAJEROS
1,2016-03-14,00:00:00,CALLE,HERRERA,SI,"HERRERA y VALLE, ARISTOBULO DEL",4,-58.37813396,-34.63668504,MOTO,PASAJEROS
1,2016-03-19,11:00:00,AVENIDA,LAFUENTE AV.,SI,LAFUENTE AV. y QUIRNO,7,-58.46275892,-34.64358293,MOTO,MOTO
1,2016-03-21,08:00:00,GRAL PAZ,"PAZ, GRAL. AV.",SI,"PAZ, GRAL. AV. y ZUVIRIA",8,-58.49683458,-34.67892743,PEATON,PASAJEROS
1,2016-03-23,01:00:00,AVENIDA,"MITRE, BARTOLOME",SI,"MITRE, BARTOLOME y PUEYRREDON AV.",3,-58.40603217,-34.6088396,MOTO,PASAJEROS
2,2016-03-29,11:00:00,AVENIDA,DIRECTORIO AV.,SI,DIRECTORIO AV. y RIVERA INDARTE AV.,7,-58.4607655,-34.63350444,MOTO,CARGAS
1,2016-03-30,18:00:00,AVENIDA,"DELLEPIANE, LUIS, TTE. GRAL.",SI,"DELLEPIANE, LUIS, TTE. GRAL. y MURGUIONDO",8,-58.47832463,-34.67494416,PEATON,CARGAS
1,2016-03-31,19:00:00,AVENIDA,"MORENO, JOSE MARIA AV.",SI,"MORENO, JOSE MARIA AV. y BALBASTRO",7,-58.43213235,-34.63693953,MOTO,MULTIPLE
1,2016-04-11,10:00:00,GRAL PAZ,"PAZ, GRAL. AV.",SI,"PAZ, GRAL. AV. y DEL LIBERTADOR AV.",13,-58.46743471,-34.53476874,MOTO,SD
1,2016-04-15,05:00:00,CALLE,LIMA,NO,LIMA 1483,1,-58.38247061,-34.62571878,PEATON,PASAJEROS
1,2016-04-15,17:00:00,AVENIDA,CORRIENTES AV.,SI,CORRIENTES AV. y DORREGO AV.,15,-58.44759966,-34.5917024,PEATON,PASAJEROS
1,2016-04-17,00:00:00,AUTOPISTA,AUTOPISTA 1 SUR PRESIDENTE ARTURO FRONDIZI,NO,AUTOPISTA 1 SUR PRESIDENTE ARTURO FRONDIZI,4,-58.37714647568196,-34.63657525428238,SD,SD
1,2016-04-19,09:00:00,AVENIDA,"GORDILLO, TIMOTEO",SI,"GORDILLO, TIMOTEO y FERNANDEZ DE LA CRUZ, F., GRAL. AV.",8,-58.47305463,-34.68550712,PEATON,PASAJEROS
1,2016-04-20,04:00:00,AVENIDA,"ALCORTA, AMANCIO AV.",SI,"ALCORTA, AMANCIO AV. y BONAVENA, OSCAR NATALIO",4,-58.40623949,-34.65076549,MOTO,CARGAS
1,2016-04-22,09:00:00,AVENIDA,TRIUNVIRATO AV.,SI,TRIUNVIRATO AV. y OLAZABAL AV.,12,-58.4842918,-34.57558053,PEATON,PASAJEROS
1,2016-04-23,21:00:00,AUTOPISTA,AUTOPISTA DELLEPIANE LUIS TTE. GRAL.,SI,"AUTOPISTA DELLEPIANE LUIS TTE. GRAL. y PAZ, GRAL. AV.",8,-58.48695354,-34.68795245,MOTO,MOTO
1,2016-04-25,20:00:00,AVENIDA,"CASTILLA, RAMON, MARISCAL",SI,"CASTILLA, RAMON, MARISCAL y FIGUEROA ALCORTA, PRES. AV.",14,-58.40021959,-34.57964781,PEATON,CARGAS
1,2016-04-26,04:00:00,AVENIDA,"CAMPOS, LUIS M. AV.",NO,"CAMPOS, LUIS M. AV. 30",14,-58.42957885,-34.57660058,MOTO,OBJETO FIJO
1,2016-05-04,14:00:00,CALLE,LIMA,NO,LIMA 1471,1,-58.38247542,-34.62556293,PEATON,MOTO
1,2016-05-08,16:00:00,CALLE,CIUDADELA,SI,CIUDADELA y LIMA,1,-58.38222219,-34.62728101,PEATON,PASAJEROS
1,2016-05-14,18:00:00,AVENIDA,"JUSTO, JUAN B. AV.",SI,"JUSTO, JUAN B. AV. y CARRASCO AV.",10,-58.49485242,-34.62953445,PEATON,PASAJEROS
1,2016-05-20,14:00:00,AVENIDA,GAONA AV.,SI,GAONA AV. y ESPINOSA,6,-58.45227946,-34.61068024,PEATON,AUTO
1,2016-05-21,17:00:00,AVENIDA,"DE LA TORRE, LISANDRO",SI,"DE LA TORRE, LISANDRO y SARAZA",8,-58.48455411,-34.6751276,MOTO,PASAJEROS
1,2016-05-22,22:00:00,AVENIDA,"FIGUEROA ALCORTA, PRES. AV.",SI,"FIGUEROA ALCORTA, PRES. AV. y PUEYRREDON AV.",2,-58.39056593,-34.58418569,MOTO,PASAJEROS
1,2016-05-23,03:00:00,AVENIDA,ENTRE RIOS AV.,SI,ENTRE RIOS AV. y FILIBERTO,3,-58.39118948,-34.62704273,AUTO,CARGAS
1,2016-06-11,15:00:00,CALLE,"MAGARI?OS CERVANTES, A.",NO,"MAGARIÃ‘OS CERVANTES, A. 3900",10,-58.49021952,-34.62025108,MOTO,CARGAS
1,2016-06-12,06:00:00,GRAL PAZ,"PAZ, GRAL. AV.",SI,"PAZ, GRAL. AV. y SCAPINO, RODOLFO",8,-58.49896559,-34.67732118,AUTO,AUTO
1,2016-06-12,23:00:00,AUTOPISTA,AUTOPISTA DELLEPIANE LUIS TTE. GRAL.,SI,AUTOPISTA DELLEPIANE LUIS TTE. GRAL. y MIRALLA,8,-58.47461076,-34.66874679,PEATON,AUTO
1,2016-06-13,16:00:00,AVENIDA,SAN MARTIN AV.,SI,SAN MARTIN AV. y CAMARONES,15,-58.46210891,-34.60356211,PEATON,PASAJEROS
1,2016-06-13,21:00:00,AVENIDA,"PERON, JUAN DOMINGO, TTE. GENERAL",SI,"PERON, JUAN DOMINGO, TTE. GENERAL y ALEM, LEANDRO N. AV.",1,-58.3702777,-34.60536123,PEATON,PASAJEROS
1,2016-06-13,23:00:00,AVENIDA,BELGRANO AV.,SI,BELGRANO AV. y JUJUY AV.,3,-58.40491455,-34.6146383,MOTO,MOTO
1,2016-06-16,17:00:00,AVENIDA,DEL LIBERTADOR AV.,SI,"DEL LIBERTADOR AV. y UDAONDO, GUILLERMO AV.",13,-58.45504154,-34.54864492,AUTO,AUTO
1,2016-06-18,06:00:00,GRAL PAZ,"PAZ, GRAL. AV.",SI,"PAZ, GRAL. AV. y RIVADAVIA AV.",9,-58.52927982,-34.63931752,AUTO,SD
1,2016-06-22,07:00:00,AVENIDA,"LARRALDE, CRISOLOGO AV.",SI,"LARRALDE, CRISOLOGO AV. y MACHAIN",12,-58.4872106,-34.55904606,MOTO,AUTO
1,2016-06-27,18:00:00,AVENIDA,LA PLATA AV.,NO,LA PLATA AV. 2384,4,-58.42273092,-34.64228803,PEATON,AUTO
1,2016-06-28,20:00:00,AVENIDA,"ALBERDI, JUAN BAUTISTA AV.",SI,"ALBERDI, JUAN BAUTISTA AV. y PUAN",6,-58.44788671,-34.62539009,PEATON,MOTO
1,2016-06-29,22:00:00,CALLE,"PELLEGRINI, CARLOS",SI,"PELLEGRINI, CARLOS y TUCUMAN",1,-58.38110563,-34.60135531,PEATON,PASAJEROS
1,2016-06-29,22:00:00,AVENIDA,"RABANAL, FRANCISCO, INTENDENTE AV.",SI,"RABANAL, FRANCISCO, INTENDENTE AV. y EREZCANO",4,-58.42378834,-34.657341,MOTO,OTRO
1,2016-06-30,16:00:00,AVENIDA,OLIVERA AV.,SI,"OLIVERA AV. y FALCON, RAMON L.,CNEL.",10,-58.48727942,-34.63652467,PEATON,PASAJEROS
1,2016-07-02,00:00:00,AUTOPISTA,AUTOPISTA 1 SUR PRESIDENTE ARTURO FRONDIZI,NO,AUTOPISTA 1 SUR PRESIDENTE ARTURO FRONDIZI y CASEROS AV.,1,-58.37864583,-34.62907067,MOTO,OBJETO FIJO
1,2016-07-11,15:00:00,CALLE,CERETTI,SI,CERETTI y NUÃ‘EZ,12,-58.5015175,-34.56767549,PEATON,AUTO
1,2016-07-14,06:00:00,AUTOPISTA,"LUGONES, LEOPOLDO AV.",SI,"LUGONES, LEOPOLDO AV. y LA PAMPA",13,-58.43233425,-34.55185825,PEATON,AUTO
1,2016-07-14,22:00:00,AVENIDA,"SALGUERO, JERONIMO",SI,"SALGUERO, JERONIMO y RIVADAVIA AV.",5,-58.41971993,-34.6111224,PEATON,PASAJEROS
1,2016-07-15,11:00:00,GRAL PAZ,"PAZ, GRAL. AV.",SI,"PAZ, GRAL. AV. y DEL LIBERTADOR AV.",13,-58.46743471,-34.53476874,MOTO,CARGAS
1,2016-07-17,03:00:00,AVENIDA,"ALBERDI, JUAN BAUTISTA AV.",SI,"ALBERDI, JUAN BAUTISTA AV. y MITRE, EMILIO",6,-58.44362126,-34.62301748,AUTO,AUTO
1,2016-07-23,06:00:00,AVENIDA,MERCEDES,SI,MERCEDES y MOSCONI GENERAL AV.,11,-58.51713095,-34.59546519,MOTO,AUTO
1,2016-07-25,07:00:00,AUTOPISTA,AUTOPISTA DELLEPIANE LUIS TTE. GRAL.,NO,AUTOPISTA DELLEPIANE LUIS TTE. GRAL.,8,-58.47433193007387,-34.66684950051973,MOTO,CARGAS
1,2016-07-26,18:00:00,CALLE,SOLIS,SI,SOLIS y MEXICO,1,-58.39038605,-34.6156281,PEATON,AUTO
1,2016-07-27,16:00:00,AVENIDA,SAN JUAN AV.,SI,SAN JUAN AV. y ALBERTI,3,-58.40042405,-34.62356174,MOTO,CARGAS
1,2016-07-29,16:00:00,GRAL PAZ,MOSCONI GENERAL AV.,SI,"MOSCONI GENERAL AV. y PAZ, GRAL. AV.",11,-58.52340614,-34.59798754,CARGAS,CARGAS
1,2016-08-03,23:00:00,GRAL PAZ,"PAZ, GRAL. AV.",SI,"PAZ, GRAL. AV. y DONADO",12,-58.49491054,-34.54795581,MOTO,OBJETO FIJO
1,2016-08-07,19:00:00,GRAL PAZ,"PAZ, GRAL. AV.",SI,"PAZ, GRAL. AV. y CHAVEZ, JORGE",9,-58.52932872,-34.65014993,SD,SD
1,2016-08-10,23:00:00,AVENIDA,"PERON, EVA AV.",SI,"PERON, EVA AV. y SUAREZ, JOSE LEON",9,-58.50011639,-34.67316502,MOTO,CARGAS
1,2016-08-14,21:00:00,AVENIDA,ZINNY,SI,ZINNY y SANTIAGO DE COMPOSTELA AV.,9,-58.46635001,-34.65624369,MOTO,PASAJEROS
1,2016-08-17,00:00:00,AVENIDA,"LACROZE, FEDERICO AV.",SI,"LACROZE, FEDERICO AV. y FRAGA",15,-58.45343236,-34.58435809,PEATON,PASAJEROS
1,2016-08-19,21:00:00,AVENIDA,"PELLEGRINI, CARLOS",SI,"PELLEGRINI, CARLOS y DEL LIBERTADOR AV.",1,-58.38090932,-34.58927731,PEATON,PASAJEROS
1,2016-08-20,08:00:00,AUTOPISTA,AUTOPISTA 1 SUR PRESIDENTE ARTURO FRONDIZI,NO,AUTOPISTA 1 SUR PRESIDENTE ARTURO FRONDIZI y DON PEDRO DE MENDOZA AV.,4,-58.37157668,-34.65429986,MOTO,AUTO
1,2016-08-24,05:00:00,AUTOPISTA,AUTOPISTA PERITO MORENO,SI,AUTOPISTA PERITO MORENO y BARRAGAN,9,-58.52280139,-34.63659934,AUTO,OBJETO FIJO
1,2016-08-24,20:00:00,AVENIDA,"ALBERDI, JUAN BAUTISTA AV.",SI,"ALBERDI, JUAN BAUTISTA AV. y CARHUE",9,-58.51232237,-34.6590353,PEATON,SD
1,2016-08-25,09:00:00,AUTOPISTA,LUGONES,SI,LUGONES y LA PAMPA,15,-58.47461905,-34.57663634,MOTO,CARGAS
1,2016-08-27,04:00:00,AUTOPISTA,AUTOPISTA 25 DE MAYO,SI,AUTOPISTA 25 DE MAYO y AUTOPISTA 1 SUR PRESIDENTE ARTURO FRONDIZI,1,-58.38268809,-34.62282019,MOTO,OBJETO FIJO
1,2016-08-27,16:00:00,AVENIDA,"ALBERDI, JUAN BAUTISTA AV.",SI,"ALBERDI, JUAN BAUTISTA AV. y GUARDIA NACIONAL",9,-58.49603546,-34.64564271,PEATON,PASAJEROS
1,2016-08-31,11:00:00,CALLE,"SALGUERO, JERONIMO",NO,"SALGUERO, JERONIMO 1410",14,-58.41848605,-34.59394733,BICICLETA,CARGAS
1,2016-09-02,11:00:00,CALLE,ARIAS,SI,ARIAS y TRONADOR,12,-58.48935041,-34.54917673,SD,CARGAS
1,2016-09-02,20:00:00,AVENIDA,27 DE FEBRERO AV.,SI,27 DE FEBRERO AV. y ESCALADA AV.,8,-58.44451316,-34.68475866,MOTO,AUTO
1,2016-09-03,15:00:00,AVENIDA,DEL LIBERTADOR AV.,SI,DEL LIBERTADOR AV. y TAGLE,14,-58.39936478,-34.58271474,AUTO,AUTO
1,2016-09-04,03:00:00,AUTOPISTA,AUTOPISTA 1 SUR PRESIDENTE ARTURO FRONDIZI,NO,AUTOPISTA 1 SUR PRESIDENTE ARTURO FRONDIZI KM. 2.9,1,-58.37936704,-34.62694503,AUTO,AUTO
1,2016-09-04,06:00:00,AVENIDA,"LARRALDE, CRISOLOGO AV.",SI,"LARRALDE, CRISOLOGO AV. y TRIUNVIRATO AV.",12,-58.49659234,-34.56353635,SD,SD
1,2016-09-13,07:00:00,AVENIDA,"PERON, EVA AV.",NO,"PERON, EVA AV. 4233",9,-58.47256391,-34.65194557,BICICLETA,PASAJEROS
1,2016-09-14,09:00:00,AVENIDA,ASAMBLEA AV.,SI,"ASAMBLEA AV. y BONORINO, ESTEBAN, CNEL. AV.",7,-58.45130953,-34.64053676,MOTO,AUTO
1,2016-09-16,15:00:00,AVENIDA,RIVADAVIA AV.,SI,RIVADAVIA AV. y RIVERA INDARTE AV.,7,-58.46271207,-34.62884871,PEATON,PASAJEROS
1,2016-09-17,12:00:00,AUTOPISTA,AUTOPISTA PERITO MORENO,SI,"AUTOPISTA PERITO MORENO y ALBERDI, JUAN BAUTISTA AV.",10,-58.49020869,-34.64243791,MOTO,MOTO
2,2016-09-18,22:00:00,CALLE,IRIGOYEN,SI,IRIGOYEN y TINOGASTA,10,-58.52572109,-34.62125906,AUTO,CARGAS
1,2016-09-24,10:00:00,AVENIDA,"ACOSTA, MARIANO",SI,"ACOSTA, MARIANO y ROCA, CNEL. AV.",8,-58.44094791,-34.66677111,PEATON,PASAJEROS
1,2016-10-02,11:00:00,AVENIDA,CASTRO,SI,CASTRO y PAVON AV.,5,-58.41914024,-34.6305389,PEATON,PASAJEROS
1,2016-10-04,12:00:00,AUTOPISTA,AUTOPISTA 1 SUR PRESIDENTE ARTURO FRONDIZI,NO,AUTOPISTA 1 SUR PRESIDENTE ARTURO FRONDIZI y BRASIL,1,-58.37910942,-34.62764717,MOTO,CARGAS
1,2016-10-09,19:00:00,CALLE,MIRAVE,NO,MIRAVE 3500,4,-58.39871183,-34.64539318,PEATON,AUTO
1,2016-10-10,02:00:00,AVENIDA,SAN JUAN AV.,SI,SAN JUAN AV. y 24 DE NOVIEMBRE,3,-58.41036975,-34.62477021,AUTO,PASAJEROS
1,2016-10-14,00:00:00,AVENIDA,LAS HERAS GENERAL AV.,SI,LAS HERAS GENERAL AV. y SANCHEZ DE BUSTAMANTE,14,-58.40204698,-34.5834269,MOTO,AUTO
1,2016-10-23,05:00:00,AVENIDA,PIEDRA BUENA AV.,SI,PIEDRA BUENA AV. y 2 DE ABRIL DE 1982,8,-58.48935287,-34.67648597,MOTO,OBJETO FIJO
1,2016-10-24,05:00:00,AVENIDA,"FIGUEROA ALCORTA, PRES. AV.",SI,"FIGUEROA ALCORTA, PRES. AV. y PINEDO, INT.",14,-58.42260225,-34.56403694,PEATON,SD
1,2016-10-25,00:00:00,AVENIDA,SAN MARTIN AV.,SI,SAN MARTIN AV. y LADINES,11,-58.51537091,-34.59035925,MOTO,MOTO
1,2016-10-27,20:00:00,AVENIDA,CABILDO AV.,SI,CABILDO AV. y BLANCO ENCALADA,13,-58.4590967,-34.55922742,BICICLETA,CARGAS
1,2016-10-28,23:00:00,AVENIDA,"FIGUEROA ALCORTA, PRES. AV.",SI,"FIGUEROA ALCORTA, PRES. AV. y DORREGO AV.",14,-58.42008769,-34.56539579,MOTO,MOTO
1,2016-10-31,02:00:00,AVENIDA,JURAMENTO AV.,SI,JURAMENTO AV. y VUELTA DE OBLIGADO,13,-58.45566399,-34.56147293,PASAJEROS,PASAJEROS
1,2016-11-05,23:00:00,AVENIDA,DEL LIBERTADOR AV.,SI,"DEL LIBERTADOR AV. y RAMOS MEJIA, JOSE MARIA, DR. AV.",1,-58.37533517,-34.59276462,MOTO,PASAJEROS
1,2016-11-06,04:00:00,AVENIDA,27 DE FEBRERO AV.,SI,27 DE FEBRERO AV. y ESCALADA AV.,8,-58.44451316,-34.68475866,MOTO,SD
1,2016-11-07,12:00:00,AVENIDA,"BROWN, ALTE. AV.",NO,"BROWN, ALTE. AV. 984",4,-58.35975012,-34.63343907,PEATON,PASAJEROS
1,2016-11-07,20:00:00,AVENIDA,DEL LIBERTADOR AV.,SI,DEL LIBERTADOR AV. y LA PAMPA,13,-58.44523595,-34.55953855,MOTO,AUTO
1,2016-11-09,20:00:00,AVENIDA,PICHINCHA AV.,SI,PICHINCHA AV. y BRASIL,4,-58.39626094,-34.63036565,PEATON,PASAJEROS
1,2016-11-16,21:00:00,AVENIDA,INDEPENDENCIA AV.,SI,"INDEPENDENCIA AV. y CEVALLOS, VIRREY",1,-58.38896772,-34.61799615,MOVIL,PASAJEROS
1,2016-11-16,22:00:00,AVENIDA,GARMENDIA AV.,NO,GARMENDIA AV. 4895,15,-58.46536113,-34.59484504,MOTO,MOTO
1,2016-11-18,18:00:00,AVENIDA,"ALCORTA, AMANCIO AV.",SI,"ALCORTA, AMANCIO AV. y TABORDA, DIOGENES",4,-58.40879146,-34.65273216,CARGAS,CARGAS
1,2016-11-23,21:00:00,AVENIDA,"MORENO, PERITO AV.",SI,"MORENO, PERITO AV. y ZUVIRIA",7,-58.46451841,-34.64991946,MOTO,AUTO
1,2016-11-25,15:00:00,AVENIDA,ARAOZ,SI,ARAOZ y CORDOBA AV.,15,-58.4291709,-34.59485488,PEATON,MOTO
1,2016-11-26,14:00:00,GRAL PAZ,"PAZ, GRAL. AV.",NO,"PAZ, GRAL. AV. 15200",8,-58.49007772,-34.68251141,MOTO,MOTO
1,2016-11-26,16:00:00,CALLE,MADERO,NO,MADERO 900,10,-58.52756365,-34.62772274,PEATON,AUTO
1,2016-11-26,19:00:00,AVENIDA,INDEPENDENCIA AV.,SI,INDEPENDENCIA AV. y DEAN FUNES,3,-58.40638983,-34.61943202,MOTO,PASAJEROS
1,2016-12-03,06:00:00,AVENIDA,"JUSTO, JUAN B. AV.",NO,"JUSTO, JUAN B. AV. 5645",11,-58.47576807,-34.61740997,MOTO,MOTO
1,2016-12-04,07:00:00,AVENIDA,27 DE FEBRERO AV.,SI,27 DE FEBRERO AV. y ESCALADA AV.,8,-58.44451316,-34.68475866,AUTO,SD
1,2016-12-06,05:00:00,AUTOPISTA,AUTOPISTA PERITO MORENO,NO,AUTOPISTA PERITO MORENO (ALTURA VELEZ SARSFIELD),9,-58.51927194,-34.63635787,CARGAS,OBJETO FIJO
1,2016-12-06,07:00:00,AVENIDA,SANTA FE AV.,SI,SANTA FE AV. y GODOY CRUZ,14,-58.42525456,-34.57866344,PEATON,PASAJEROS
1,2016-12-07,05:00:00,AVENIDA,"LACROZE, FEDERICO AV.",SI,"LACROZE, FEDERICO AV. y FOREST AV.",15,-58.45396573,-34.58518167,PEATON,AUTO
1,2016-12-10,07:00:00,GRAL PAZ,"PAZ, GRAL. AV.",SI,"PAZ, GRAL. AV. y MOSCONI GENERAL AV.",11,-58.52340614,-34.59798754,MOTO,AUTO
1,2016-12-11,06:00:00,AVENIDA,LA PLATA AV.,SI,"LA PLATA AV. y POMAR, GREGORIO TTE. CNEL.",4,-58.42323628,-34.64119105,AUTO,AUTO
1,2016-12-12,08:00:00,AVENIDA,"GARCIA, MARTIN AV.",NO,"GARCIA, MARTIN AV. 300",4,-58.36926144,-34.62841919,BICICLETA,PASAJEROS
1,2016-12-13,10:00:00,AVENIDA,LA PLATA AV.,SI,"LA PLATA AV. y POMAR, GREGORIO TTE. CNEL.",4,-58.42323628,-34.64119105,MOTO,AUTO
1,2016-12-15,15:00:00,AVENIDA,NU?EZ,SI,"NUÃ‘EZ y BALBIN, RICARDO, DR. AV.",12,-58.47935434,-34.55676497,MOTO,PASAJEROS
1,2016-12-19,17:00:00,GRAL PAZ,"PAZ, GRAL. AV.",NO,"PAZ, GRAL. AV. 4500",12,-58.50598256,-34.5637998,MOTO,AUTO
1,2016-12-25,19:00:00,AUTOPISTA,"HUERGO, ING. AV.",SI,"HUERGO, ING. AV. y AUTOPISTA 25 DE MAYO",1,-58.36607137,-34.62150748,MOTO,MOTO
1,2016-12-26,08:00:00,AVENIDA,"GARAY, JUAN DE AV.",SI,"GARAY, JUAN DE AV. y CASTRO",5,-58.41918902,-34.63174259,MOTO,CARGAS
1,2016-12-26,19:00:00,AVENIDA,DIRECTORIO AV.,SI,DIRECTORIO AV. y SAN PEDRITO AV.,7,-58.46749188,-34.63551751,MOTO,CARGAS
1,2016-12-27,08:00:00,CALLE,"FALCON, RAMON L.,CNEL.",SI,"FALCON, RAMON L.,CNEL. y MEMBRILLAR",7,-58.46064174,-34.62960517,PEATON,BICICLETA
1,2016-12-28,01:00:00,AVENIDA,BELGRANO AV.,SI,BELGRANO AV. y PASEO COLON AV.,1,-58.36956186,-34.61232875,MOTO,PASAJEROS
1,2016-12-29,04:00:00,CALLE,ARENALES,NO,ARENALES 3319,14,-58.40966671,-34.58788235,PEATON,AUTO
1,2016-12-30,16:00:00,CALLE,REPUBLICA BOLIVARIANA DE VENEZUELA,SI,REPUBLICA BOLIVARIANA DE VENEZUELA y SAAVEDRA,3,-58.40288226,-34.61544091,PEATON,MULTIPLE
1,2017-01-02,01:00:00,AVENIDA,"JUSTO, JUAN B. AV.",SI,"JUSTO, JUAN B. AV. y ACHUPALLAS",11,-58.4659423,-34.61028571,MOTO,CARGAS
1,2017-01-05,03:00:00,AVENIDA,OLAVARRIA,SI,OLAVARRIA y VELEZ SARSFIELD AV.,4,-58.38957669,-34.64410277,CARGAS,CARGAS
1,2017-01-11,17:00:00,CALLE,LIMA,SI,LIMA y MEXICO,1,-58.3816166,-34.61529543,PEATON,MULTIPLE
1,2017-01-16,00:00:00,CALLE,"CABRERA, JOSE A.",SI,"CABRERA, JOSE A. y BONPLAND",14,-58.43917004,-34.58494351,MOTO,PASAJEROS
1,2017-01-16,13:00:00,AUTOPISTA,AUTOPISTA 25 DE MAYO,NO,AUTOPISTA 25 DE MAYO y BOEDO AV.,5,-58.41595919,-34.62743346,MOTO,CARGAS
1,2017-01-16,16:00:00,AVENIDA,DIRECTORIO AV.,SI,DIRECTORIO AV. y RIGLOS,6,-58.4356488,-34.62828656,MOTO,AUTO
1,2017-01-22,02:00:00,GRAL PAZ,"PAZ, GRAL. AV.",SI,"PAZ, GRAL. AV. y BALBIN, RICARDO, DR. AV.",12,-58.5007381,-34.5497951,MOTO,OBJETO FIJO
1,2017-01-24,14:00:00,CALLE,TRAFUL,SI,"TRAFUL y TABORDA, DIOGENES",4,-58.40969005,-34.6505529,MOTO,CARGAS
1,2017-01-27,07:00:00,AVENIDA,"IRIARTE, GRAL. AV.",NO,"IRIARTE, GRAL. AV. 3055",4,-58.38972622,-34.65098981,PEATON,CARGAS
1,2017-01-28,08:00:00,AVENIDA,DONADO,SI,DONADO y ARIAS,12,-58.49185972,-34.55046754,MOTO,MULTIPLE
1,2017-02-02,15:00:00,AVENIDA,CORDOBA AV.,SI,CORDOBA AV. y CALLAO AV.,2,-58.39293417,-34.59963642,PEATON,AUTO
1,2017-02-03,05:00:00,AUTOPISTA,AUTOPISTA 25 DE MAYO,NO,AUTOPISTA 25 DE MAYO KM. 8.3,1,-58.38099494,-34.62288231,MOTO,CARGAS
1,2017-02-06,08:00:00,AVENIDA,"JUSTO, JUAN B. AV.",SI,"JUSTO, JUAN B. AV. y PARAGUAY",14,-58.429012,-34.58095431,MOTO,AUTO
1,2017-02-09,07:00:00,GRAL PAZ,"PAZ, GRAL. AV.",SI,"PAZ, GRAL. AV. y DE LOS CORRALES AV.",9,-58.50877521,-34.66977709,MOTO,AUTO
1,2017-02-18,05:00:00,CALLE,SARMIENTO,SI,SARMIENTO y LIBERTAD,1,-58.38362373,-34.60509972,MOTO,PASAJEROS
1,2017-02-23,20:00:00,AVENIDA,RIVADAVIA AV.,NO,RIVADAVIA AV. 7121,7,-58.46589308,-34.62955795,PEATON,PASAJEROS
1,2017-02-24,17:00:00,AVENIDA,"FERNANDEZ DE LA CRUZ, F., GRAL. AV.",SI,"FERNANDEZ DE LA CRUZ, F., GRAL. AV. y RIVERA INDARTE AV.",7,-58.43614426,-34.6542464,MOTO,SD
2,2017-02-26,05:00:00,AVENIDA,"MORENO, PERITO AV.",SI,"MORENO, PERITO AV. y FOURNIER",4,-58.41842777,-34.64979057,AUTO,OBJETO FIJO
1,2017-02-26,21:00:00,AVENIDA,CASEROS AV.,NO,CASEROS AV. 1429,1,-58.38332245,-34.6319325,PEATON,AUTO
1,2017-02-28,09:00:00,AVENIDA,GAONA AV.,SI,GAONA AV. y FRAGATA PRES. SARMIENTO,6,-58.45475488,-34.61196327,PEATON,AUTO
1,2017-03-07,02:00:00,CALLE,MOZART,SI,MOZART y TANDIL,9,-58.48501341,-34.64742455,SD,AUTO
1,2017-03-07,08:00:00,AVENIDA,MOZART,SI,MOZART y AUTOPISTA DELLEPIANE LUIS TTE. GRAL.,9,-58.47010988,-34.65872088,AUTO,PASAJEROS
1,2017-03-11,01:00:00,CALLE,24 DE NOVIEMBRE,SI,24 DE NOVIEMBRE y PAVON,3,-58.4099756,-34.62873635,AUTO,OBJETO FIJO
1,2017-03-12,05:00:00,GRAL PAZ,"PAZ, GRAL. AV.",SI,"PAZ, GRAL. AV. y LOS CEDROS",8,-58.48892175,-34.68359163,AUTO,AUTO
1,2017-03-12,07:00:00,GRAL PAZ,"PAZ, GRAL. AV.",SI,"PAZ, GRAL. AV. y GUTIERREZ, RICARDO",11,-58.52466448,-34.60325478,AUTO,AUTO
1,2017-03-13,07:00:00,CALLE,GODOY CRUZ,NO,GODOY CRUZ 2651,14,-58.42554218,-34.57929036,PEATON,AUTO
3,2017-03-23,05:00:00,AVENIDA,"ACHAVAL RODRIGUEZ, T., DR. AV.",SI,"ACHAVAL RODRIGUEZ, T., DR. AV. y VILLAFLOR, AZUCENA",1,-58.35881506,-34.61113641,AUTO,OBJETO FIJO
2,2017-03-29,18:00:00,GRAL PAZ,"PAZ, GRAL. AV.",SI,"PAZ, GRAL. AV. y CAMPANA",12,-58.51452347,-34.58159762,MOTO,PASAJEROS
1,2017-03-31,03:00:00,AVENIDA,INDEPENDENCIA AV.,SI,"INDEPENDENCIA AV. y CEVALLOS, VIRREY",1,-58.38896772,-34.61799615,MOTO,CARGAS
1,2017-04-01,19:00:00,AVENIDA,CASTA?ARES AV.,SI,CASTAÃ‘ARES AV. y LAUTARO,7,-58.44516857,-34.64363363,MOTO,AUTO
1,2017-04-03,09:00:00,AVENIDA,"GUIRALDES, INT.",NO,"GUIRALDES, INT. 2699",13,-58.43834197,-34.54560369,AUTO,MULTIPLE
1,2017-04-03,23:00:00,CALLE,"FERNANDEZ MORENO, BALDOMERO",NO,"FERNANDEZ MORENO, BALDOMERO 2186",7,-58.45485084,-34.63531854,MOTO,AUTO
1,2017-04-14,06:00:00,CALLE,NOGOYA,NO,NOGOYA 5940,10,-58.52449285,-34.62454175,MOTO,OBJETO FIJO
1,2017-04-23,06:00:00,AVENIDA,ARGENTINA AV.,SI,ARGENTINA AV. y CORVALAN,8,-58.46713742,-34.6719879,MOTO,AUTO
1,2017-04-27,18:00:00,AVENIDA,"FERNANDEZ DE LA CRUZ, F., GRAL. AV.",SI,"FERNANDEZ DE LA CRUZ, F., GRAL. AV. y VARELA AV.",8,-58.43850413,-34.65554754,PEATON,PASAJEROS
1,2017-05-05,03:00:00,GRAL PAZ,"PAZ, GRAL. AV.",SI,"PAZ, GRAL. AV. y GOLETA SANTA CRUZ",8,-58.49413799,-34.68095739,PEATON,CARGAS
1,2017-05-05,20:00:00,CALLE,VIEYTES,SI,VIEYTES y VILLARINO,4,-58.37547846,-34.65326075,MOTO,CARGAS
1,2017-05-07,21:00:00,AVENIDA,DE LOS CONSTITUYENTES AV.,SI,"DE LOS CONSTITUYENTES AV. y MORAN, PEDRO",15,-58.48680218,-34.58689719,MOTO,AUTO
1,2017-05-09,08:00:00,AVENIDA,DE LOS CONSTITUYENTES AV.,NO,DE LOS CONSTITUYENTES AV. 4900,12,-58.49563989,-34.57962262,AUTO,AUTO
1,2017-05-09,23:00:00,AVENIDA,CORDOBA AV.,SI,CORDOBA AV. y LIBERTAD,1,-58.38403232,-34.5991594,PEATON,MOTO
1,2017-05-11,09:00:00,CALLE,BRASIL,SI,BRASIL y LIMA,1,-58.38223382,-34.62693865,PEATON,PASAJEROS
1,2017-05-13,07:00:00,AVENIDA,ESCALADA AV.,SI,"ESCALADA AV. y FERNANDEZ DE LA CRUZ, F., GRAL. AV.",8,-58.45966521,-34.67323292,MOTO,OBJETO FIJO
1,2017-05-15,13:00:00,AVENIDA,PARAGUAY,SI,PARAGUAY y CALLAO AV.,2,-58.39303911,-34.59871111,PEATON,MOTO
1,2017-05-15,16:00:00,AVENIDA,"JUSTO, JUAN B. AV.",SI,"JUSTO, JUAN B. AV. y SAN BLAS",10,-58.51262106,-34.63395999,MOTO,CARGAS
1,2017-05-17,10:00:00,AVENIDA,CHILE,SI,CHILE y 9 DE JULIO AV.,1,-58.38118367,-34.61646839,PEATON,PASAJEROS
1,2017-05-20,05:00:00,CALLE,MAIPU,SI,"MAIPU y PERON, JUAN DOMINGO, TTE. GENERAL",1,-58.37653284,-34.60582475,CARGAS,AUTO
1,2017-05-22,16:00:00,AVENIDA,SUAREZ AV.,SI,SUAREZ AV. y HERRERA,4,-58.37709334,-34.64035082,BICICLETA,CARGAS
1,2017-05-22,18:00:00,AVENIDA,SAN MARTIN AV.,SI,SAN MARTIN AV. y FRAGATA PRES. SARMIENTO,15,-58.46002142,-34.60409469,PEATON,PASAJEROS
1,2017-05-23,02:00:00,AVENIDA,DIRECTORIO AV.,SI,"DIRECTORIO AV. y MORENO, JOSE MARIA AV.",6,-58.4338197,-34.62801894,MOTO,CARGAS
1,2017-05-27,19:00:00,AVENIDA,"RABANAL, FRANCISCO, INTENDENTE AV.",NO,"RABANAL, FRANCISCO, INTENDENTE AV. 2950",8,-58.43580656,-34.66437532,MOTO,OBJETO FIJO
1,2017-05-24,14:00:00,GRAL PAZ,"PAZ, GRAL. AV.",SI,"PAZ, GRAL. AV. y SCHMIDL, ULRICO",9,-58.52173071,-34.65997463,MOTO,SD
1,2017-05-30,13:00:00,CALLE,NUEVA YORK,NO,NUEVA YORK 3696,11,-58.50791763,-34.59804273,PEATON,AUTO
1,2017-06-03,23:00:00,AVENIDA,DE LOS CONSTITUYENTES AV.,SI,DE LOS CONSTITUYENTES AV. y VALLEJOS,12,-58.49175088,-34.58226957,AUTO,AUTO
1,2017-06-04,09:00:00,AVENIDA,CORRIENTES AV.,SI,CORRIENTES AV. y ECUADOR,3,-58.40781467,-34.60425669,MOTO,AUTO
1,2017-06-04,12:00:00,CALLE,CASCO,NO,CASCO 133,9,-58.52567073,-34.63787791,SD,SD
1,2017-06-12,22:00:00,AVENIDA,DE MAYO AV.,SI,DE MAYO AV. y 9 DE JULIO AV.,1,-58.381542,-34.60906385,PEATON,MOTO
1,2017-06-13,14:00:00,AVENIDA,"CASTILLO, RAMON S., PRES. AV.",SI,"CASTILLO, RAMON S., PRES. AV. y CALLE 12 (NO OFICIAL)",2,-58.38526125,-34.5780581,PEATON,CARGAS
1,2017-06-17,23:00:00,CALLE,FRAY JUSTO SANTAMARIA DE ORO,NO,FRAY JUSTO SANTAMARIA DE ORO 1930,14,-58.42934104,-34.58451712,MOTO,CARGAS
1,2017-06-19,16:00:00,CALLE,MEXICO,SI,MEXICO y DEAN FUNES,3,-58.40657493,-34.61781124,MOTO,CARGAS
1,2017-06-22,10:00:00,AVENIDA,"ALBERDI, JUAN BAUTISTA AV.",SI,"ALBERDI, JUAN BAUTISTA AV. y ESCALADA AV.",9,-58.49525314,-34.64487785,PEATON,CARGAS
1,2017-06-25,22:00:00,AVENIDA,ENTRE RIOS AV.,SI,ENTRE RIOS AV. y BRASIL,4,-58.39092851,-34.62932696,PEATON,AUTO
1,2017-07-04,00:00:00,AVENIDA,"ALBERDI, JUAN BAUTISTA AV.",SI,"ALBERDI, JUAN BAUTISTA AV. y GUARDIA NACIONAL",9,-58.49603546,-34.64564271,MOTO,CARGAS
1,2017-07-05,12:00:00,AVENIDA,DEL LIBERTADOR AV.,SI,DEL LIBERTADOR AV. y RODRIGUEZ PEÃ‘A,2,-58.38502878,-34.58703485,PEATON,PASAJEROS
1,2017-07-07,14:00:00,AVENIDA,TACUARI,SI,"TACUARI y GARCIA, MARTIN AV.",4,-58.37261143,-34.63150425,PEATON,PASAJEROS
1,2017-07-09,07:00:00,AVENIDA,RIVADAVIA AV.,SI,RIVADAVIA AV. y MURGUIONDO,9,-58.51876802,-34.63905965,PEATON,MOTO
